<?xml version="1.0" encoding="UTF-8"?>
<queryConfigs xmlns="http://xmlns.rise.com/common/v1" xmlns:xsi="http://www.w3.org/2001/XMLSchema-instance" xsi:schemaLocation="http://xmlns.rise.com/common/v1 ../../com.rise.xmlns/xsd/com.rise.query.config.xsd ">
  <queryConfig>
    <className>com.rise.common.model.Person</className>
    <component>
      <name>educationQualifications</name>
      <name>employmentExperiences</name>
      <name>contactInformation</name>
      <name>driversLicense</name>
      <name>personName</name>
      <name>candidate</name>
      <name>passport</name>
      <name>awards</name>
    </component>
    <superClass>
      <name>baseModel</name>
    </superClass>
    <field>
      <name>id</name>
      <type>java.lang.Integer</type>
    </field>
    <field>
      <name>dateOfBirth</name>
      <type>java.util.Date</type>
    </field>
    <field>
      <name>aadhaarNumber</name>
      <type>java.lang.String</type>
    </field>
  </queryConfig>
   <queryConfig>
    <className>com.rise.common.model.PersonName</className>
    <component>
      <name>hi</name>
    </component>
    <superClass>
      <name>com.rise.common.model.BaseModel</name>
    </superClass>
    <field>
      <name>title</name>
      <type>java.lang.String</type>
    </field>
    <field>
      <name>firstName</name>
      <type>java.lang.String</type>
    </field>
    <field>
      <name>middleName</name>
      <type>java.lang.String</type>
    </field>
    <field>
      <name>lastName</name>
      <type>java.lang.String</type>
    </field>
    <field>
      <name>suffix</name>
      <type>java.lang.String</type>
    </field>
  </queryConfig>
</queryConfigs>
