<?xml version="1.0" encoding="UTF-8"?>
<queryConfigs xmlns="http://xmlns.rise.com/common/v1" xmlns:xsi="http://www.w3.org/2001/XMLSchema-instance" xsi:schemaLocation="http://xmlns.rise.com/common/v1 ../xsd/com.rise.query.config.xsd ">
  <queryConfig>
    <className>token</className>
    <component>
      <name>token</name>
    </component>
    <superClass>
      <name>token</name>
    </superClass>
    <field>
      <name>token</name>
      <type>token</type>
    </field>
  </queryConfig>
</queryConfigs>
